<?xml version="1.0" encoding="UTF-8"?>
<!DOCTYPE sources PUBLIC
  "-//Penrose/DTD Sources ${product.specification}//EN"
  "http://penrose.safehaus.org/dtd/sources.dtd">

<sources>

  <source name="sambaFE">
    <connection-name>SambaFE</connection-name>
    <parameter>
      <param-name>baseDn</param-name>
      <param-value>DC=samba,DC=example,DC=com</param-value>
    </parameter>
  </source>

  <source name="sambaUsersFE">
    <connection-name>SambaFE</connection-name>
    <parameter>
      <param-name>baseDn</param-name>
      <param-value>DC=samba,DC=example,DC=com</param-value>
    </parameter>
    <parameter>
      <param-name>filter</param-name>
      <param-value>(&amp;(objectClass=user)(!(objectClass=computer))(!(servicePrincipalName=*)))</param-value>
    </parameter>
    <parameter>
      <param-name>attributes</param-name>
      <param-value>
          objectClass cn sn sAMAccountName
          homeDirectory accountExpires pwdLastSet
          objectSid lastLogon scriptPath
          profilePath logonCount badPwdCount primaryGroupID
          userAccountControl objectGUID supplementalCredentials
      </param-value>
    </parameter>
  </source>

  <source name="sambaUsersBE">
    <connection-name>SambaBE</connection-name>
    <parameter>
      <param-name>baseDn</param-name>
      <param-value>DC=samba,DC=example,DC=com</param-value>
    </parameter>
    <parameter>
      <param-name>filter</param-name>
      <param-value>(&amp;(objectClass=user)(!(objectClass=computer))(!(servicePrincipalName=*)))</param-value>
    </parameter>
    <parameter>
      <param-name>attributes</param-name>
      <param-value>
          objectClass cn sn sAMAccountName
          sambaHomePath accountExpires sambaPwdLastSet
          sambaSID lastLogon scriptPath
          sambaProfilePath logonCount badPwdCount primaryGroupID
          userAccountControl nsUniqueId supplementalCredentials
      </param-value>
    </parameter>
  </source>

  <source name="samba_groups">
    <connection-name>SambaBE</connection-name>
    <parameter>
      <param-name>baseDn</param-name>
      <param-value>DC=samba,DC=example,DC=com</param-value>
    </parameter>
    <parameter>
      <param-name>filter</param-name>
      <param-value>(objectClass=group)</param-value>
    </parameter>
  </source>

  <source name="samba_hosts">
    <connection-name>SambaBE</connection-name>
    <parameter>
      <param-name>baseDn</param-name>
      <param-value>DC=samba,DC=example,DC=com</param-value>
    </parameter>
    <parameter>
      <param-name>filter</param-name>
      <param-value>(objectClass=computer)</param-value>
    </parameter>
  </source>

</sources>

