<?xml version="1.0" encoding="UTF-8"?>
<!DOCTYPE sources PUBLIC
  "-//Penrose/DTD Sources ${product.specification}//EN"
  "http://penrose.safehaus.org/dtd/sources.dtd">

<sources>

  <source name="ipa">
    <connection-name>IPA</connection-name>
    <parameter>
      <param-name>baseDn</param-name>
      <param-value>dc=example,dc=com</param-value>
    </parameter>
  </source>

  <source name="ipaUsers">
    <connection-name>IPA</connection-name>
    <parameter>
      <param-name>baseDn</param-name>
      <param-value>cn=users,cn=accounts,dc=example,dc=com</param-value>
    </parameter>
    <parameter>
      <param-name>scope</param-name>
      <param-value>ONELEVEL</param-value>
    </parameter>
  </source>

  <source name="ipa_groups">
    <connection-name>IPA</connection-name>
    <parameter>
      <param-name>baseDn</param-name>
      <param-value>cn=groups,cn=accounts,dc=example,dc=com</param-value>
    </parameter>
    <parameter>
      <param-name>scope</param-name>
      <param-value>ONELEVEL</param-value>
    </parameter>
  </source>

  <source name="ipa_hosts">
    <connection-name>IPA</connection-name>
    <parameter>
      <param-name>baseDn</param-name>
      <param-value>cn=hosts,cn=accounts,dc=example,dc=com</param-value>
    </parameter>
    <parameter>
      <param-name>scope</param-name>
      <param-value>ONELEVEL</param-value>
    </parameter>
  </source>

</sources>
