<?xml version="1.0" encoding="UTF-8"?>
<!DOCTYPE sources PUBLIC
  "-//Penrose/DTD Sources ${product.specification}//EN"
  "http://penrose.safehaus.org/dtd/sources.dtd">

<sources>

  <source name="posixAccount">
    <connection-name>Posix</connection-name>
    <field name="cn"/>
    <field name="uid" primaryKey="true"/>
    <field name="uidNumber" type="INTEGER"/>
    <field name="gidNumber" type="INTEGER"/>
    <field name="homeDirectory"/>
    <field name="authPassword"/>
    <field name="userPassword"/>
    <field name="loginShell"/>
    <field name="gecos"/>
    <field name="description"/>
    <parameter>
      <param-name>table</param-name>
      <param-value>posixAccount</param-value>
    </parameter>
  </source>

  <source name="shadowAccount">
    <connection-name>Posix</connection-name>
    <field name="uid" primaryKey="true"/>
    <field name="authPassword"/>
    <field name="userPassword"/>
    <field name="description"/>
    <field name="shadowLastChange" type="INTEGER"/>
    <field name="shadowMin" type="INTEGER"/>
    <field name="shadowMax" type="INTEGER"/>
    <field name="shadowWarning" type="INTEGER"/>
    <field name="shadowInactive" type="INTEGER"/>
    <field name="shadowExpire" type="INTEGER"/>
    <field name="shadowFlag" type="INTEGER"/>
    <parameter>
      <param-name>table</param-name>
      <param-value>shadowAccount</param-value>
    </parameter>
  </source>

  <source name="posixGroup">
    <connection-name>Posix</connection-name>
    <field name="cn" primaryKey="true"/>
    <field name="gidNumber" type="INTEGER"/>
    <field name="authPassword"/>
    <field name="userPassword"/>
    <field name="description"/>
    <parameter>
      <param-name>table</param-name>
      <param-value>posixGroup</param-value>
    </parameter>
  </source>

  <source name="posixGroup_memberUid">
    <connection-name>Posix</connection-name>
    <field name="cn" primaryKey="true"/>
    <field name="memberUid" primaryKey="true"/>
    <parameter>
      <param-name>table</param-name>
      <param-value>posixGroup_memberUid</param-value>
    </parameter>
  </source>

  <source name="device">
    <connection-name>Posix</connection-name>
    <field name="cn" primaryKey="true"/>
    <field name="serialNumber"/>
    <field name="seeAlso"/>
    <field name="owner"/>
    <field name="ou"/>
    <field name="o"/>
    <field name="l"/>
    <field name="description"/>
    <parameter>
      <param-name>table</param-name>
      <param-value>device</param-value>
    </parameter>
  </source>

  <source name="ipHost">
    <connection-name>Posix</connection-name>
    <field name="cn" primaryKey="true"/>
    <field name="ipHostNumber"/>
    <parameter>
      <param-name>table</param-name>
      <param-value>ipHost</param-value>
    </parameter>
  </source>

  <source name="ipHost_alias">
    <connection-name>Posix</connection-name>
    <field name="cn" primaryKey="true"/>
    <field name="alias" primaryKey="true"/>
    <parameter>
      <param-name>table</param-name>
      <param-value>ipHost_alias</param-value>
    </parameter>
  </source>

  <source name="ieee802Device">
    <connection-name>Posix</connection-name>
    <field name="cn" primaryKey="true"/>
    <field name="macAddress"/>
    <parameter>
      <param-name>table</param-name>
      <param-value>ieee802Device</param-value>
    </parameter>
  </source>

  <source name="ipNetwork">
    <connection-name>Posix</connection-name>
    <field name="cn" primaryKey="true"/>
    <field name="ipNetworkNumber"/>
    <field name="ipNetmaskNumber"/>
    <field name="l"/>
    <field name="description"/>
    <field name="manager"/>
    <parameter>
      <param-name>table</param-name>
      <param-value>ipNetwork</param-value>
    </parameter>
  </source>

  <source name="ipNetwork_alias">
    <connection-name>Posix</connection-name>
    <field name="cn" primaryKey="true"/>
    <field name="alias" primaryKey="true"/>
    <parameter>
      <param-name>table</param-name>
      <param-value>ipNetwork_alias</param-value>
    </parameter>
  </source>

  <source name="ipService">
    <connection-name>Posix</connection-name>
    <field name="cn" primaryKey="true"/>
    <field name="ipServicePort" type="INTEGER"/>
    <field name="ipServiceProtocol" primaryKey="true"/>
    <field name="description"/>
    <parameter>
      <param-name>table</param-name>
      <param-value>ipService</param-value>
    </parameter>
  </source>

  <source name="ipService_alias">
    <connection-name>Posix</connection-name>
    <field name="cn" primaryKey="true"/>
    <field name="ipServiceProtocol" primaryKey="true"/>
    <field name="alias" primaryKey="true"/>
    <parameter>
      <param-name>table</param-name>
      <param-value>ipService_alias</param-value>
    </parameter>
  </source>

  <source name="ipProtocol">
    <connection-name>Posix</connection-name>
    <field name="cn" primaryKey="true"/>
    <field name="ipProtocolNumber"/>
    <field name="description"/>
    <parameter>
      <param-name>table</param-name>
      <param-value>ipProtocol</param-value>
    </parameter>
  </source>

  <source name="ipProtocol_alias">
    <connection-name>Posix</connection-name>
    <field name="cn" primaryKey="true"/>
    <field name="alias" primaryKey="true"/>
    <parameter>
      <param-name>table</param-name>
      <param-value>ipProtocol_alias</param-value>
    </parameter>
  </source>

  <source name="oncRpc">
    <connection-name>Posix</connection-name>
    <field name="cn" primaryKey="true"/>
    <field name="oncRpcNumber"/>
    <field name="description"/>
    <parameter>
      <param-name>table</param-name>
      <param-value>oncRpc</param-value>
    </parameter>
  </source>

  <source name="oncRpc_alias">
    <connection-name>Posix</connection-name>
    <field name="cn" primaryKey="true"/>
    <field name="alias" primaryKey="true"/>
    <parameter>
      <param-name>table</param-name>
      <param-value>oncRpc_alias</param-value>
    </parameter>
  </source>

  <source name="nisNetgroup">
    <connection-name>Posix</connection-name>
    <field name="cn" primaryKey="true"/>
    <field name="description"/>
    <parameter>
      <param-name>table</param-name>
      <param-value>nisNetgroup</param-value>
    </parameter>
  </source>

  <source name="nisNetgroup_nisNetgroupTriple">
    <connection-name>Posix</connection-name>
    <field name="cn" primaryKey="true"/>
    <field name="nisNetgroupTriple" primaryKey="true"/>
    <parameter>
      <param-name>table</param-name>
      <param-value>nisNetgroup_nisNetgroupTriple</param-value>
    </parameter>
  </source>

  <source name="nisNetgroup_memberNisNetgroup">
    <connection-name>Posix</connection-name>
    <field name="cn" primaryKey="true"/>
    <field name="memberNisNetgroup" primaryKey="true"/>
    <parameter>
      <param-name>table</param-name>
      <param-value>nisNetgroup_memberNisNetgroup</param-value>
    </parameter>
  </source>

  <source name="automountMap">
    <connection-name>Posix</connection-name>
    <field name="automountMapName" primaryKey="true"/>
    <field name="description"/>
    <parameter>
      <param-name>table</param-name>
      <param-value>automountMap</param-value>
    </parameter>
  </source>

  <source name="automount">
    <connection-name>Posix</connection-name>
    <field name="automountMapName" primaryKey="true"/>
    <field name="automountKey" primaryKey="true"/>
    <field name="automountInformation"/>
    <field name="description"/>
    <parameter>
      <param-name>table</param-name>
      <param-value>automount</param-value>
    </parameter>
  </source>

</sources>
