<?xml version="1.0" encoding="UTF-8"?>
<!DOCTYPE sources PUBLIC
  "-//Penrose/DTD Sources ${product.specification}//EN"
  "http://penrose.safehaus.org/dtd/sources.dtd">

<sources>

  <source name="plain">
    <connection-name>Database</connection-name>
    <field name="username" primaryKey="true"/>
    <field name="firstName"/>
    <field name="lastName"/>
    <field name="password"/>
    <parameter>
      <param-name>table</param-name>
      <param-value>plain</param-value>
    </parameter>
  </source>

  <source name="crypt">
    <connection-name>Database</connection-name>
    <field name="username" primaryKey="true"/>
    <field name="firstName"/>
    <field name="lastName"/>
    <field name="password"/>
    <parameter>
      <param-name>table</param-name>
      <param-value>crypt</param-value>
    </parameter>
  </source>

  <source name="crypt_md5">
    <connection-name>Database</connection-name>
    <field name="username" primaryKey="true"/>
    <field name="firstName"/>
    <field name="lastName"/>
    <field name="password"/>
    <parameter>
      <param-name>table</param-name>
      <param-value>crypt_md5</param-value>
    </parameter>
  </source>

  <source name="crypt_sha256">
    <connection-name>Database</connection-name>
    <field name="username" primaryKey="true"/>
    <field name="firstName"/>
    <field name="lastName"/>
    <field name="password"/>
    <parameter>
      <param-name>table</param-name>
      <param-value>crypt_sha256</param-value>
    </parameter>
  </source>

  <source name="crypt_sha512">
    <connection-name>Database</connection-name>
    <field name="username" primaryKey="true"/>
    <field name="firstName"/>
    <field name="lastName"/>
    <field name="password"/>
    <parameter>
      <param-name>table</param-name>
      <param-value>crypt_sha512</param-value>
    </parameter>
  </source>

  <source name="md5">
    <connection-name>Database</connection-name>
    <field name="username" primaryKey="true"/>
    <field name="firstName"/>
    <field name="lastName"/>
    <field name="password"/>
    <parameter>
      <param-name>table</param-name>
      <param-value>md5</param-value>
    </parameter>
  </source>

  <source name="sha">
    <connection-name>Database</connection-name>
    <field name="username" primaryKey="true"/>
    <field name="firstName"/>
    <field name="lastName"/>
    <field name="password"/>
    <parameter>
      <param-name>table</param-name>
      <param-value>sha</param-value>
    </parameter>
  </source>

</sources>
