<?xml version="1.0" encoding="UTF-8"?>
<!DOCTYPE sources PUBLIC
  "-//Penrose/DTD Sources ${product.specification}//EN"
  "http://penrose.safehaus.org/dtd/sources.dtd">

<sources>

  <source name="ipa_changelog">
    <connection-name>IPA</connection-name>
    <parameter>
      <param-name>baseDn</param-name>
      <param-value>cn=changelog</param-value>
    </parameter>
  </source>

  <source name="ipa_tracker">
    <connection-name>Database</connection-name>
    <field name="changeNumber" type="INTEGER" primaryKey="true"/>
    <field name="changeTimestamp" type="DATETIME"/>
    <parameter>
      <param-name>table</param-name>
      <param-value>ipa_tracker</param-value>
    </parameter>
    <parameter>
      <param-name>create</param-name>
      <param-value>true</param-value>
    </parameter>
  </source>

</sources>

