<?xml version="1.0" encoding="UTF-8"?>
<!DOCTYPE sources PUBLIC
  "-//Penrose/DTD Sources ${product.specification}//EN"
  "http://penrose.safehaus.org/dtd/sources.dtd">

<sources>

  <source name="users">
    <connection-name>Source</connection-name>
    <field name="uid" primaryKey="true"/>
    <field name="cn"/>
    <field name="sn"/>
    <field name="userPassword"/>
    <parameter>
      <param-name>baseDn</param-name>
      <param-value>ou=Users,dc=Example,dc=com</param-value>
    </parameter>
    <parameter>
      <param-name>scope</param-name>
      <param-value>ONELEVEL</param-value>
    </parameter>
    <parameter>
      <param-name>objectClasses</param-name>
      <param-value>person,organizationalPerson,inetOrgPerson</param-value>
    </parameter>
  </source>

  <source name="groups">
    <connection-name>Source</connection-name>
    <field name="cn" primaryKey="true"/>
    <field name="uniqueMember"/>
    <parameter>
      <param-name>baseDn</param-name>
      <param-value>ou=Groups,dc=Example,dc=com</param-value>
    </parameter>
    <parameter>
      <param-name>scope</param-name>
      <param-value>ONELEVEL</param-value>
    </parameter>
    <parameter>
      <param-name>objectClasses</param-name>
      <param-value>groupOfUniqueNames</param-value>
    </parameter>
  </source>

  <source name="changelog">
    <connection-name>Source</connection-name>
    <parameter>
      <param-name>baseDn</param-name>
      <param-value>cn=changelog</param-value>
    </parameter>
    <parameter>
      <param-name>scope</param-name>
      <param-value>ONELEVEL</param-value>
    </parameter>
  </source>

  <source name="users_cache">
    <connection-name>Cache</connection-name>
    <field name="uid" primaryKey="true"/>
    <field name="cn"/>
    <field name="sn"/>
    <field name="userPassword"/>
    <parameter>
      <param-name>baseDn</param-name>
      <param-value>ou=Users,dc=Example,dc=com</param-value>
    </parameter>
    <parameter>
      <param-name>scope</param-name>
      <param-value>ONELEVEL</param-value>
    </parameter>
    <parameter>
      <param-name>objectClasses</param-name>
      <param-value>person,organizationalPerson,inetOrgPerson</param-value>
    </parameter>
  </source>

  <source name="groups_cache">
    <connection-name>Cache</connection-name>
    <field name="cn" primaryKey="true"/>
    <field name="uniqueMember"/>
    <parameter>
      <param-name>baseDn</param-name>
      <param-value>ou=Groups,dc=Example,dc=com</param-value>
    </parameter>
    <parameter>
      <param-name>scope</param-name>
      <param-value>ONELEVEL</param-value>
    </parameter>
    <parameter>
      <param-name>objectClasses</param-name>
      <param-value>groupOfUniqueNames</param-value>
    </parameter>
  </source>

  <source name="users_tracker">
    <connection-name>Tracker</connection-name>
    <field name="changeNumber" type="INTEGER" primaryKey="true"/>
    <field name="changeTimestamp" type="DATETIME"/>
    <parameter>
      <param-name>table</param-name>
      <param-value>users_tracker</param-value>
    </parameter>
  </source>

  <source name="groups_tracker">
    <connection-name>Tracker</connection-name>
    <field name="changeNumber" type="INTEGER" primaryKey="true"/>
    <field name="changeTimestamp" type="DATETIME"/>
    <parameter>
      <param-name>table</param-name>
      <param-value>groups_tracker</param-value>
    </parameter>
  </source>

</sources>
