<?xml version="1.0" encoding="UTF-8"?>
<!DOCTYPE sources PUBLIC
  "-//Penrose/DTD Sources ${product.specification}//EN"
  "http://penrose.safehaus.org/dtd/sources.dtd">

<sources>

  <source name="users">
    <connection-name>Active Directory</connection-name>
    <field name="cn" primaryKey="true"/>
    <field name="sn"/>
    <field name="sAMAccountName"/>
    <field name="unicodePwd"/>
    <field name="userAccountControl"/>
    <parameter>
      <param-name>baseDn</param-name>
      <param-value>cn=Users,dc=Example,dc=com</param-value>
    </parameter>
    <parameter>
      <param-name>scope</param-name>
      <param-value>ONELEVEL</param-value>
    </parameter>
    <parameter>
      <param-name>filter</param-name>
      <param-value>(objectClass=user)</param-value>
    </parameter>
    <parameter>
      <param-name>objectClasses</param-name>
      <param-value>user</param-value>
    </parameter>
    <parameter>
      <param-name>authentication</param-name>
      <param-value>full</param-value>
    </parameter>
  </source>

  <source name="groups">
    <connection-name>Active Directory</connection-name>
    <field name="cn" primaryKey="true"/>
    <field name="member"/>
    <parameter>
      <param-name>baseDn</param-name>
      <param-value>cn=Users,dc=Example,dc=com</param-value>
    </parameter>
    <parameter>
      <param-name>scope</param-name>
      <param-value>ONELEVEL</param-value>
    </parameter>
    <parameter>
      <param-name>filter</param-name>
      <param-value>(objectClass=group)</param-value>
    </parameter>
    <parameter>
      <param-name>objectClasses</param-name>
      <param-value>group</param-value>
    </parameter>
  </source>

</sources>
