<?xml version="1.0" encoding="UTF-8"?>
<!DOCTYPE sources PUBLIC
  "-//Penrose/DTD Sources ${product.specification}//EN"
  "http://penrose.safehaus.org/dtd/sources.dtd">

<sources>

  <source name="ad_schema">
    <connection-name>Active Directory</connection-name>
    <parameter>
      <param-name>baseDn</param-name>
      <param-value>cn=Schema,cn=Configuration,dc=AD,dc=Example,dc=com</param-value>
    </parameter>
    <parameter>
      <param-name>newBaseDn</param-name>
      <param-value>cn=AD Style,dc=AD Schema,dc=Example,dc=com</param-value>
    </parameter>
  </source>

  <source name="ldap_schema">
    <connection-name>Active Directory</connection-name>
    <field name="lDAPDisplayName" primaryKey="true"/>
    <field name="objectClass"/>
    <field name="attributeID"/>
    <field name="adminDescription"/>
    <field name="attributeSyntax"/>
    <field name="isSingleValued"/>
    <field name="governsID"/>
    <field name="mustContain"/>
    <field name="systemMustContain"/>
    <field name="mayContain"/>
    <field name="systemMayContain"/>
    <parameter>
      <param-name>baseDn</param-name>
      <param-value>cn=Schema,cn=Configuration,dc=AD,dc=Example,dc=com</param-value>
    </parameter>
    <parameter>
      <param-name>scope</param-name>
      <param-value>ONELEVEL</param-value>
    </parameter>
  </source>

</sources>
