<?xml version="1.0" encoding="UTF-8"?>
<!DOCTYPE sources PUBLIC
  "-//Penrose/DTD Sources ${product.specification}//EN"
  "http://penrose.safehaus.org/dtd/sources.dtd">

<sources>

  <source name="users">
    <connection-name>LDAP</connection-name>
    <field name="uid" primaryKey="true"/>
    <field name="cn"/>
    <field name="sn"/>
    <field name="userPassword"/>
    <parameter>
      <param-name>baseDn</param-name>
      <param-value>ou=Users,dc=my-domain,dc=com</param-value>
    </parameter>
    <parameter>
      <param-name>scope</param-name>
      <param-value>ONELEVEL</param-value>
    </parameter>
    <parameter>
      <param-name>objectClasses</param-name>
      <param-value>person,organizationalPerson,inetOrgPerson</param-value>
    </parameter>
  </source>

  <source name="groups">
    <connection-name>LDAP</connection-name>
    <field name="cn" primaryKey="true"/>
    <field name="description"/>
    <field name="uniqueMember"/>
    <parameter>
      <param-name>baseDn</param-name>
      <param-value>ou=Groups,dc=my-domain,dc=com</param-value>
    </parameter>
    <parameter>
      <param-name>scope</param-name>
      <param-value>ONELEVEL</param-value>
    </parameter>
    <parameter>
      <param-name>filter</param-name>
      <param-value>(objectClass=*)</param-value>
    </parameter>
    <parameter>
      <param-name>objectClasses</param-name>
      <param-value>groupOfUniqueNames</param-value>
    </parameter>
  </source>

</sources>
